[{"definition":"excluded lower threshold mass of the declared generator benchmark","denominator":null,"numerator":null,"observable_id":"ATLAS_RS_n1_electron_jet_Mth","observable_type":"MASS_THRESHOLD","schema_version":"1.0.0","unit":"TeV"},{"definition":"excluded lower threshold mass of the declared generator benchmark","denominator":null,"numerator":null,"observable_id":"ATLAS_RS_n1_muon_jet_Mth","observable_type":"MASS_THRESHOLD","schema_version":"1.0.0","unit":"TeV"},{"definition":"excluded lower threshold mass of the declared generator benchmark","denominator":null,"numerator":null,"observable_id":"ATLAS_ADD_n2_electron_jet_Mth","observable_type":"MASS_THRESHOLD","schema_version":"1.0.0","unit":"TeV"},{"definition":"excluded lower threshold mass of the declared generator benchmark","denominator":null,"numerator":null,"observable_id":"ATLAS_ADD_n2_muon_jet_Mth","observable_type":"MASS_THRESHOLD","schema_version":"1.0.0","unit":"TeV"},{"definition":"excluded lower threshold mass of the declared generator benchmark","denominator":null,"numerator":null,"observable_id":"ATLAS_ADD_n4_electron_jet_Mth","observable_type":"MASS_THRESHOLD","schema_version":"1.0.0","unit":"TeV"},{"definition":"excluded lower threshold mass of the declared generator benchmark","denominator":null,"numerator":null,"observable_id":"ATLAS_ADD_n4_muon_jet_Mth","observable_type":"MASS_THRESHOLD","schema_version":"1.0.0","unit":"TeV"},{"definition":"excluded lower threshold mass of the declared generator benchmark","denominator":null,"numerator":null,"observable_id":"ATLAS_ADD_n6_electron_jet_Mth","observable_type":"MASS_THRESHOLD","schema_version":"1.0.0","unit":"TeV"},{"definition":"excluded lower threshold mass of the declared generator benchmark","denominator":null,"numerator":null,"observable_id":"ATLAS_ADD_n6_muon_jet_Mth","observable_type":"MASS_THRESHOLD","schema_version":"1.0.0","unit":"TeV"},{"definition":"excluded lower threshold mass of the declared generator benchmark","denominator":null,"numerator":null,"observable_id":"CMS_B1_n2_MD2_Mmin","observable_type":"MASS_THRESHOLD","schema_version":"1.0.0","unit":"TeV"},{"definition":"excluded lower threshold mass of the declared generator benchmark","denominator":null,"numerator":null,"observable_id":"CMS_B1_n2_MD3_Mmin","observable_type":"MASS_THRESHOLD","schema_version":"1.0.0","unit":"TeV"},{"definition":"excluded lower threshold mass of the declared generator benchmark","denominator":null,"numerator":null,"observable_id":"CMS_B1_n2_MD4_Mmin","observable_type":"MASS_THRESHOLD","schema_version":"1.0.0","unit":"TeV"},{"definition":"excluded lower threshold mass of the declared generator benchmark","denominator":null,"numerator":null,"observable_id":"CMS_B1_n2_MD5_Mmin","observable_type":"MASS_THRESHOLD","schema_version":"1.0.0","unit":"TeV"},{"definition":"excluded lower threshold mass of the declared generator benchmark","denominator":null,"numerator":null,"observable_id":"CMS_B1_n2_MD6_Mmin","observable_type":"MASS_THRESHOLD","schema_version":"1.0.0","unit":"TeV"},{"definition":"excluded lower threshold mass of the declared generator benchmark","denominator":null,"numerator":null,"observable_id":"CMS_B1_n2_MD7_Mmin","observable_type":"MASS_THRESHOLD","schema_version":"1.0.0","unit":"TeV"},{"definition":"excluded lower threshold mass of the declared generator benchmark","denominator":null,"numerator":null,"observable_id":"CMS_B1_n2_MD8_Mmin","observable_type":"MASS_THRESHOLD","schema_version":"1.0.0","unit":"TeV"},{"definition":"excluded lower threshold mass of the declared generator benchmark","denominator":null,"numerator":null,"observable_id":"CMS_B1_n2_MD9_Mmin","observable_type":"MASS_THRESHOLD","schema_version":"1.0.0","unit":"TeV"},{"definition":"excluded lower threshold mass of the declared generator benchmark","denominator":null,"numerator":null,"observable_id":"CMS_B1_n4_MD2_Mmin","observable_type":"MASS_THRESHOLD","schema_version":"1.0.0","unit":"TeV"},{"definition":"excluded lower threshold mass of the declared generator benchmark","denominator":null,"numerator":null,"observable_id":"CMS_B1_n4_MD3_Mmin","observable_type":"MASS_THRESHOLD","schema_version":"1.0.0","unit":"TeV"},{"definition":"excluded lower threshold mass of the declared generator benchmark","denominator":null,"numerator":null,"observable_id":"CMS_B1_n4_MD4_Mmin","observable_type":"MASS_THRESHOLD","schema_version":"1.0.0","unit":"TeV"},{"definition":"excluded lower threshold mass of the declared generator benchmark","denominator":null,"numerator":null,"observable_id":"CMS_B1_n4_MD5_Mmin","observable_type":"MASS_THRESHOLD","schema_version":"1.0.0","unit":"TeV"},{"definition":"excluded lower threshold mass of the declared generator benchmark","denominator":null,"numerator":null,"observable_id":"CMS_B1_n4_MD6_Mmin","observable_type":"MASS_THRESHOLD","schema_version":"1.0.0","unit":"TeV"},{"definition":"excluded lower threshold mass of the declared generator benchmark","denominator":null,"numerator":null,"observable_id":"CMS_B1_n4_MD7_Mmin","observable_type":"MASS_THRESHOLD","schema_version":"1.0.0","unit":"TeV"},{"definition":"excluded lower threshold mass of the declared generator benchmark","denominator":null,"numerator":null,"observable_id":"CMS_B1_n4_MD8_Mmin","observable_type":"MASS_THRESHOLD","schema_version":"1.0.0","unit":"TeV"},{"definition":"excluded lower threshold mass of the declared generator benchmark","denominator":null,"numerator":null,"observable_id":"CMS_B1_n4_MD9_Mmin","observable_type":"MASS_THRESHOLD","schema_version":"1.0.0","unit":"TeV"},{"definition":"excluded lower threshold mass of the declared generator benchmark","denominator":null,"numerator":null,"observable_id":"CMS_B1_n6_MD2_Mmin","observable_type":"MASS_THRESHOLD","schema_version":"1.0.0","unit":"TeV"},{"definition":"excluded lower threshold mass of the declared generator benchmark","denominator":null,"numerator":null,"observable_id":"CMS_B1_n6_MD3_Mmin","observable_type":"MASS_THRESHOLD","schema_version":"1.0.0","unit":"TeV"},{"definition":"excluded lower threshold mass of the declared generator benchmark","denominator":null,"numerator":null,"observable_id":"CMS_B1_n6_MD4_Mmin","observable_type":"MASS_THRESHOLD","schema_version":"1.0.0","unit":"TeV"},{"definition":"excluded lower threshold mass of the declared generator benchmark","denominator":null,"numerator":null,"observable_id":"CMS_B1_n6_MD5_Mmin","observable_type":"MASS_THRESHOLD","schema_version":"1.0.0","unit":"TeV"},{"definition":"excluded lower threshold mass of the declared generator benchmark","denominator":null,"numerator":null,"observable_id":"CMS_B1_n6_MD6_Mmin","observable_type":"MASS_THRESHOLD","schema_version":"1.0.0","unit":"TeV"},{"definition":"excluded lower threshold mass of the declared generator benchmark","denominator":null,"numerator":null,"observable_id":"CMS_B1_n6_MD7_Mmin","observable_type":"MASS_THRESHOLD","schema_version":"1.0.0","unit":"TeV"},{"definition":"excluded lower threshold mass of the declared generator benchmark","denominator":null,"numerator":null,"observable_id":"CMS_B1_n6_MD8_Mmin","observable_type":"MASS_THRESHOLD","schema_version":"1.0.0","unit":"TeV"},{"definition":"excluded lower threshold mass of the declared generator benchmark","denominator":null,"numerator":null,"observable_id":"CMS_B1_n6_MD9_Mmin","observable_type":"MASS_THRESHOLD","schema_version":"1.0.0","unit":"TeV"},{"definition":"excluded lower threshold mass of the declared generator benchmark","denominator":null,"numerator":null,"observable_id":"CMS_B2_n2_MD2_Mmin","observable_type":"MASS_THRESHOLD","schema_version":"1.0.0","unit":"TeV"},{"definition":"excluded lower threshold mass of the declared generator benchmark","denominator":null,"numerator":null,"observable_id":"CMS_B2_n2_MD3_Mmin","observable_type":"MASS_THRESHOLD","schema_version":"1.0.0","unit":"TeV"},{"definition":"excluded lower threshold mass of the declared generator benchmark","denominator":null,"numerator":null,"observable_id":"CMS_B2_n2_MD4_Mmin","observable_type":"MASS_THRESHOLD","schema_version":"1.0.0","unit":"TeV"},{"definition":"excluded lower threshold mass of the declared generator benchmark","denominator":null,"numerator":null,"observable_id":"CMS_B2_n2_MD5_Mmin","observable_type":"MASS_THRESHOLD","schema_version":"1.0.0","unit":"TeV"},{"definition":"excluded lower threshold mass of the declared generator benchmark","denominator":null,"numerator":null,"observable_id":"CMS_B2_n2_MD6_Mmin","observable_type":"MASS_THRESHOLD","schema_version":"1.0.0","unit":"TeV"},{"definition":"excluded lower threshold mass of the declared generator benchmark","denominator":null,"numerator":null,"observable_id":"CMS_B2_n2_MD7_Mmin","observable_type":"MASS_THRESHOLD","schema_version":"1.0.0","unit":"TeV"},{"definition":"excluded lower threshold mass of the declared generator benchmark","denominator":null,"numerator":null,"observable_id":"CMS_B2_n2_MD8_Mmin","observable_type":"MASS_THRESHOLD","schema_version":"1.0.0","unit":"TeV"},{"definition":"excluded lower threshold mass of the declared generator benchmark","denominator":null,"numerator":null,"observable_id":"CMS_B2_n2_MD9_Mmin","observable_type":"MASS_THRESHOLD","schema_version":"1.0.0","unit":"TeV"},{"definition":"excluded lower threshold mass of the declared generator benchmark","denominator":null,"numerator":null,"observable_id":"CMS_B2_n4_MD2_Mmin","observable_type":"MASS_THRESHOLD","schema_version":"1.0.0","unit":"TeV"},{"definition":"excluded lower threshold mass of the declared generator benchmark","denominator":null,"numerator":null,"observable_id":"CMS_B2_n4_MD3_Mmin","observable_type":"MASS_THRESHOLD","schema_version":"1.0.0","unit":"TeV"},{"definition":"excluded lower threshold mass of the declared generator benchmark","denominator":null,"numerator":null,"observable_id":"CMS_B2_n4_MD4_Mmin","observable_type":"MASS_THRESHOLD","schema_version":"1.0.0","unit":"TeV"},{"definition":"excluded lower threshold mass of the declared generator benchmark",